2025-11-04 21:00:51: Running tar_make
- The project is out-of-sync -- use `renv::status()` for details.
+ timestamp_VA_NA dispatched
+ timestamp_NY_NA dispatched
✔ timestamp_NY_NA completed [1.7s, 69 B]
✔ timestamp_VA_NA completed [2.1s, 69 B]
+ data_VA_NA dispatched
✔ data_VA_NA completed [15.4s, 657.50 kB]
+ model_votes_governor_25_rep_share_lm_conformal_ dispatched
+ model_votes_governor_25_rep_precinct_total_lm_conformal_ dispatched
+ model_votes_governor_25_dem_precinct_total_lm_conformal_ dispatched
+ model_turnout_xgboost_conformal_ dispatched
✔ model_votes_governor_25_rep_share_lm_conformal_ completed [2.5s, 19.31 MB]
+ summary_votes_governor_25_rep_share_lm_conformal_ dispatched
✔ summary_votes_governor_25_rep_share_lm_conformal_ completed [3ms, 507 B]
+ model_turnout_lm_conformal__1 dispatched
✔ model_votes_governor_25_rep_precinct_total_lm_conformal_ completed [2.9s, 18.61 MB]
+ summary_votes_governor_25_rep_precinct_total_lm_conformal_ dispatched
✔ summary_votes_governor_25_rep_precinct_total_lm_conformal_ completed [6ms, 510 B]
+ model_turnout_xgboost_conformal__1 dispatched
✔ model_votes_governor_25_dem_precinct_total_lm_conformal_ completed [2.9s, 18.85 MB]
+ summary_votes_governor_25_dem_precinct_total_lm_conformal_ dispatched
✔ model_turnout_lm_conformal__1 completed [2.9s, 29.17 MB]
+ summary_turnout_lm_conformal__1 dispatched
✔ summary_votes_governor_25_dem_precinct_total_lm_conformal_ completed [4ms, 510 B]
+ model_turnout_lm_conformal__2 dispatched
✔ summary_turnout_lm_conformal__1 completed [3ms, 587 B]
+ model_turnout_xgboost_conformal__2 dispatched
✔ model_turnout_xgboost_conformal_ completed [6.7s, 24.41 MB]
+ summary_turnout_xgboost_conformal_ dispatched
✔ model_turnout_lm_conformal__2 completed [2.5s, 19.85 MB]
+ summary_turnout_lm_conformal__2 dispatched
✔ summary_turnout_xgboost_conformal_ completed [3ms, 490 B]
+ model_votes_governor_25_dem_share_xgboost_conformal_ dispatched
✔ summary_turnout_lm_conformal__2 completed [3ms, 492 B]
+ model_votes_governor_25_dem_share_xgboost_conformal__1 dispatched
✖ model_votes_governor_25_dem_share_xgboost_conformal__1 errored
Error: [21:01:30] src/data/data.cc:461: Check failed: valid: Label contains NaN, infinity or a value too large.
Stack trace:
  [bt] (0) 1   xgboost.so                          0x000000017600af7c dmlc::LogMessageFatal::~LogMessageFatal() + 124
  [bt] (1) 2   xgboost.so                          0x00000001760a9d60 xgboost::MetaInfo::SetInfoFromHost(xgboost::GenericParameter const&, xgboost::StringView, xgboost::Json) + 3616
  [bt] (2) 3   xgboost.so                          0x00000001760aafe8 xgboost::MetaInfo::SetInfo(xgboost::GenericParameter const&, char const*, void const*, xgboost::DataType, unsigned long) + 168
  [bt] (3) 4   xgboost.so                          0x00000001761d4444 XGDMatrixSetFloatInfo + 132
  [bt] (4) 5   xgboost.so                          0x000000017600616c XGDMatrixSetInfo_R + 620
  [bt] (5) 6   libR.dylib                          0x0000000104a333b4 R_doDotCall + 1588
  [bt] (6) 7   libR.dylib                          0x0000000104a85e98 bcEval_loop + 86104
  [bt] (7) 8

+ model_votes_governor_25_rep_precinct_total_xgboost_conformal_ dispatched
✖ model_votes_governor_25_dem_share_xgboost_conformal_ errored
Error: [21:01:30] src/data/data.cc:461: Check failed: valid: Label contains NaN, infinity or a value too large.
Stack trace:
  [bt] (0) 1   xgboost.so                          0x000000013210af7c dmlc::LogMessageFatal::~LogMessageFatal() + 124
  [bt] (1) 2   xgboost.so                          0x00000001321a9d60 xgboost::MetaInfo::SetInfoFromHost(xgboost::GenericParameter const&, xgboost::StringView, xgboost::Json) + 3616
  [bt] (2) 3   xgboost.so                          0x00000001321aafe8 xgboost::MetaInfo::SetInfo(xgboost::GenericParameter const&, char const*, void const*, xgboost::DataType, unsigned long) + 168
  [bt] (3) 4   xgboost.so                          0x00000001322d4444 XGDMatrixSetFloatInfo + 132
  [bt] (4) 5   xgboost.so                          0x000000013210616c XGDMatrixSetInfo_R + 620
  [bt] (5) 6   libR.dylib                          0x00000001011573b4 R_doDotCall + 1588
  [bt] (6) 7   libR.dylib                          0x00000001011a9e98 bcEval_loop + 86104
  [bt] (7) 8

+ model_votes_governor_25_dem_share_xgboost_conformal__2 dispatched
✖ model_votes_governor_25_dem_share_xgboost_conformal__2 errored
Error: [21:01:31] src/data/data.cc:461: Check failed: valid: Label contains NaN, infinity or a value too large.
Stack trace:
  [bt] (0) 1   xgboost.so                          0x000000013210af7c dmlc::LogMessageFatal::~LogMessageFatal() + 124
  [bt] (1) 2   xgboost.so                          0x00000001321a9d60 xgboost::MetaInfo::SetInfoFromHost(xgboost::GenericParameter const&, xgboost::StringView, xgboost::Json) + 3616
  [bt] (2) 3   xgboost.so                          0x00000001321aafe8 xgboost::MetaInfo::SetInfo(xgboost::GenericParameter const&, char const*, void const*, xgboost::DataType, unsigned long) + 168
  [bt] (3) 4   xgboost.so                          0x00000001322d4444 XGDMatrixSetFloatInfo + 132
  [bt] (4) 5   xgboost.so                          0x000000013210616c XGDMatrixSetInfo_R + 620
  [bt] (5) 6   libR.dylib                          0x00000001011573b4 R_doDotCall + 1588
  [bt] (6) 7   libR.dylib                          0x00000001011a9e98 bcEval_loop + 86104
  [bt] (7) 8

+ model_turnout_lm_conformal_ dispatched
✔ model_turnout_lm_conformal_ completed [2.3s, 18.84 MB]
+ summary_turnout_lm_conformal_ dispatched
✔ model_turnout_xgboost_conformal__1 completed [12.2s, 26.39 MB]
+ summary_turnout_xgboost_conformal__1 dispatched
✔ summary_turnout_lm_conformal_ completed [3ms, 485 B]
+ model_votes_governor_25_rep_share_xgboost_conformal_ dispatched
✔ model_turnout_xgboost_conformal__2 completed [7.6s, 24.84 MB]
+ summary_turnout_xgboost_conformal__2 dispatched
✔ summary_turnout_xgboost_conformal__1 completed [4ms, 594 B]
+ model_votes_governor_25_rep_precinct_total_lm_conformal__1 dispatched
✔ summary_turnout_xgboost_conformal__2 completed [4ms, 497 B]
+ model_votes_governor_25_rep_precinct_total_lm_conformal__2 dispatched
✔ model_votes_governor_25_rep_precinct_total_xgboost_conformal_ completed [6.1s, 24.40 MB]
+ summary_votes_governor_25_rep_precinct_total_xgboost_conformal_ dispatched
✔ summary_votes_governor_25_rep_precinct_total_xgboost_conformal_ completed [4ms, 515 B]
+ model_votes_governor_25_dem_share_lm_conformal_ dispatched
✔ model_votes_governor_25_rep_precinct_total_lm_conformal__2 completed [2.4s, 19.78 MB]
+ summary_votes_governor_25_rep_precinct_total_lm_conformal__2 dispatched
✔ model_votes_governor_25_rep_precinct_total_lm_conformal__1 completed [2.5s, 28.88 MB]
+ summary_votes_governor_25_rep_precinct_total_lm_conformal__1 dispatched
✔ summary_votes_governor_25_rep_precinct_total_lm_conformal__2 completed [4ms, 518 B]
+ model_votes_governor_25_dem_share_lm_conformal__1 dispatched
✔ summary_votes_governor_25_rep_precinct_total_lm_conformal__1 completed [4ms, 611 B]
+ model_votes_governor_25_dem_share_lm_conformal__2 dispatched
✔ model_votes_governor_25_dem_share_lm_conformal_ completed [2.3s, 19.52 MB]
+ summary_votes_governor_25_dem_share_lm_conformal_ dispatched
✔ summary_votes_governor_25_dem_share_lm_conformal_ completed [3ms, 506 B]
+ model_votes_governor_25_rep_share_lm_conformal__1 dispatched
✔ model_votes_governor_25_rep_share_xgboost_conformal_ completed [6.2s, 24.86 MB]
+ summary_votes_governor_25_rep_share_xgboost_conformal_ dispatched
✔ summary_votes_governor_25_rep_share_xgboost_conformal_ completed [4ms, 513 B]
+ model_votes_governor_25_rep_share_lm_conformal__2 dispatched
✔ model_votes_governor_25_dem_share_lm_conformal__2 completed [2.2s, 20.50 MB]
+ summary_votes_governor_25_dem_share_lm_conformal__2 dispatched
✔ summary_votes_governor_25_dem_share_lm_conformal__2 completed [3ms, 515 B]
+ model_votes_governor_25_rep_precinct_total_xgboost_conformal__1 dispatched
✔ model_votes_governor_25_dem_share_lm_conformal__1 completed [2.3s, 29.69 MB]
+ summary_votes_governor_25_dem_share_lm_conformal__1 dispatched
✔ summary_votes_governor_25_dem_share_lm_conformal__1 completed [3ms, 606 B]
+ model_votes_governor_25_rep_precinct_total_xgboost_conformal__2 dispatched
✔ model_votes_governor_25_rep_share_lm_conformal__1 completed [2.4s, 29.54 MB]
+ summary_votes_governor_25_rep_share_lm_conformal__1 dispatched
✔ summary_votes_governor_25_rep_share_lm_conformal__1 completed [4ms, 607 B]
+ model_votes_governor_25_rep_share_xgboost_conformal__1 dispatched
✔ model_votes_governor_25_rep_share_lm_conformal__2 completed [2.4s, 20.38 MB]
+ summary_votes_governor_25_rep_share_lm_conformal__2 dispatched
✔ summary_votes_governor_25_rep_share_lm_conformal__2 completed [9ms, 515 B]
+ model_votes_governor_25_rep_share_xgboost_conformal__2 dispatched
✔ model_votes_governor_25_rep_precinct_total_xgboost_conformal__2 completed [6.8s, 25.56 MB]
+ summary_votes_governor_25_rep_precinct_total_xgboost_conformal__2 dispatched
✔ summary_votes_governor_25_rep_precinct_total_xgboost_conformal__2 completed [4ms, 522 B]
+ tbl_cbs_VA_NA dispatched
✔ model_votes_governor_25_rep_share_xgboost_conformal__2 completed [6.4s, 24.91 MB]
+ summary_votes_governor_25_rep_share_xgboost_conformal__2 dispatched
✔ summary_votes_governor_25_rep_share_xgboost_conformal__2 completed [4ms, 519 B]
+ model_votes_governor_25_dem_precinct_total_lm_conformal__1 dispatched
✔ model_votes_governor_25_rep_precinct_total_xgboost_conformal__1 completed [12.2s, 26.15 MB]
+ summary_votes_governor_25_rep_precinct_total_xgboost_conformal__1 dispatched
✔ summary_votes_governor_25_rep_precinct_total_xgboost_conformal__1 completed [3ms, 616 B]
+ model_votes_governor_25_dem_precinct_total_lm_conformal__2 dispatched
✔ model_votes_governor_25_rep_share_xgboost_conformal__1 completed [12s, 26.29 MB]
+ summary_votes_governor_25_rep_share_xgboost_conformal__1 dispatched
✔ summary_votes_governor_25_rep_share_xgboost_conformal__1 completed [3ms, 610 B]
+ model_votes_governor_25_dem_precinct_total_xgboost_conformal__1 dispatched
✖ model_votes_governor_25_dem_precinct_total_xgboost_conformal__1 errored
Error: [21:02:03] src/data/data.cc:461: Check failed: valid: Label contains NaN, infinity or a value too large.
Stack trace:
  [bt] (0) 1   xgboost.so                          0x000000017600af7c dmlc::LogMessageFatal::~LogMessageFatal() + 124
  [bt] (1) 2   xgboost.so                          0x00000001760a9d60 xgboost::MetaInfo::SetInfoFromHost(xgboost::GenericParameter const&, xgboost::StringView, xgboost::Json) + 3616
  [bt] (2) 3   xgboost.so                          0x00000001760aafe8 xgboost::MetaInfo::SetInfo(xgboost::GenericParameter const&, char const*, void const*, xgboost::DataType, unsigned long) + 168
  [bt] (3) 4   xgboost.so                          0x00000001761d4444 XGDMatrixSetFloatInfo + 132
  [bt] (4) 5   xgboost.so                          0x000000017600616c XGDMatrixSetInfo_R + 620
  [bt] (5) 6   libR.dylib                          0x0000000104a333b4 R_doDotCall + 1588
  [bt] (6) 7   libR.dylib                          0x0000000104a85e98 bcEval_loop + 86104
  [bt] (7) 8

+ model_votes_governor_25_dem_precinct_total_xgboost_conformal__2 dispatched
✔ model_votes_governor_25_dem_precinct_total_lm_conformal__1 completed [2.7s, 29.15 MB]
+ summary_votes_governor_25_dem_precinct_total_lm_conformal__1 dispatched
✔ summary_votes_governor_25_dem_precinct_total_lm_conformal__1 completed [4ms, 609 B]
+ summary_VA_NA dispatched
✔ model_votes_governor_25_dem_precinct_total_lm_conformal__2 completed [2.1s, 19.98 MB]
+ summary_votes_governor_25_dem_precinct_total_lm_conformal__2 dispatched
✖ model_votes_governor_25_dem_precinct_total_xgboost_conformal__2 errored
Error: [21:02:03] src/data/data.cc:461: Check failed: valid: Label contains NaN, infinity or a value too large.
Stack trace:
  [bt] (0) 1   xgboost.so                          0x000000017600af7c dmlc::LogMessageFatal::~LogMessageFatal() + 124
  [bt] (1) 2   xgboost.so                          0x00000001760a9d60 xgboost::MetaInfo::SetInfoFromHost(xgboost::GenericParameter const&, xgboost::StringView, xgboost::Json) + 3616
  [bt] (2) 3   xgboost.so                          0x00000001760aafe8 xgboost::MetaInfo::SetInfo(xgboost::GenericParameter const&, char const*, void const*, xgboost::DataType, unsigned long) + 168
  [bt] (3) 4   xgboost.so                          0x00000001761d4444 XGDMatrixSetFloatInfo + 132
  [bt] (4) 5   xgboost.so                          0x000000017600616c XGDMatrixSetInfo_R + 620
  [bt] (5) 6   libR.dylib                          0x0000000104a333b4 R_doDotCall + 1588
  [bt] (6) 7   libR.dylib                          0x0000000104a85e98 bcEval_loop + 86104
  [bt] (7) 8

+ corymodel dispatched
✔ summary_votes_governor_25_dem_precinct_total_lm_conformal__2 completed [4ms, 518 B]
+ model_votes_governor_25_dem_precinct_total_xgboost_conformal_ dispatched
✔ summary_VA_NA completed [304ms, 654 B]
✖ model_votes_governor_25_dem_precinct_total_xgboost_conformal_ errored
Error: [21:02:04] src/data/data.cc:461: Check failed: valid: Label contains NaN, infinity or a value too large.
Stack trace:
  [bt] (0) 1   xgboost.so                          0x000000017780af7c dmlc::LogMessageFatal::~LogMessageFatal() + 124
  [bt] (1) 2   xgboost.so                          0x00000001778a9d60 xgboost::MetaInfo::SetInfoFromHost(xgboost::GenericParameter const&, xgboost::StringView, xgboost::Json) + 3616
  [bt] (2) 3   xgboost.so                          0x00000001778aafe8 xgboost::MetaInfo::SetInfo(xgboost::GenericParameter const&, char const*, void const*, xgboost::DataType, unsigned long) + 168
  [bt] (3) 4   xgboost.so                          0x00000001779d4444 XGDMatrixSetFloatInfo + 132
  [bt] (4) 5   xgboost.so                          0x000000017780616c XGDMatrixSetInfo_R + 620
  [bt] (5) 6   libR.dylib                          0x00000001056f73b4 R_doDotCall + 1588
  [bt] (6) 7   libR.dylib                          0x0000000105749e98 bcEval_loop + 86104
  [bt] (7) 8

+ models_summary dispatched
✔ models_summary completed [1ms, 3.78 kB]
+ save_summaries dispatched
✔ save_summaries completed [1ms, 43 B]
+ dashboard dispatched
✖ corymodel errored
Error: object 'm_simple_pres' not found

✔ tbl_cbs_VA_NA completed [22.1s, 179.68 kB]
+ dashboard dispatched
✔ dashboard completed [21.3s, 16.38 MB]
+ upload dispatched
✔ upload completed [1s, 46 B]
✖ errored pipeline [1m 46.5s, 57 completed, 13 skipped]
Warning message:
7 targets produced errors. Run targets::tar_meta(fields = error, complete_only = TRUE) for the messages. 
