2025-11-04 20:54:05: Running tar_make
- The project is out-of-sync -- use `renv::status()` for details.
+ history_VA_NA dispatched
+ timestamp_VA_NA dispatched
+ timestamp_NY_NA dispatched
+ history_NY_NA dispatched
✔ timestamp_VA_NA completed [2s, 71 B]
+ data_VA_NA dispatched
✔ timestamp_NY_NA completed [2s, 69 B]
+ history_noimpute_VA_NA dispatched
✔ history_VA_NA completed [2.7s, 1.75 MB]
+ history_noimpute_NY_NA dispatched
✖ history_NY_NA errored
Error: Must group by variables found in `.data`.
✖ Column `polstratum` is not found.

+ summary_NY_NA dispatched
✖ summary_NY_NA errored
Error: could not load dependency history_NY_NA of target summary_NY_NA. invalid 'description' argument

✔ history_noimpute_VA_NA completed [192ms, 1.75 MB]
✔ history_noimpute_NY_NA completed [70ms, 2.27 MB]
✔ data_VA_NA completed [13s, 652.12 kB]
+ model_votes_governor_25_rep_share_lm_conformal_ dispatched
+ model_votes_governor_25_rep_precinct_total_lm_conformal_ dispatched
+ model_votes_governor_25_dem_precinct_total_lm_conformal_ dispatched
+ model_turnout_xgboost_conformal_ dispatched
✔ model_votes_governor_25_rep_precinct_total_lm_conformal_ completed [2.8s, 18.04 MB]
+ summary_votes_governor_25_rep_precinct_total_lm_conformal_ dispatched
✔ model_votes_governor_25_rep_share_lm_conformal_ completed [2.8s, 18.73 MB]
+ summary_votes_governor_25_rep_share_lm_conformal_ dispatched
✔ summary_votes_governor_25_rep_precinct_total_lm_conformal_ completed [3ms, 511 B]
+ model_turnout_lm_conformal__1 dispatched
✔ model_votes_governor_25_dem_precinct_total_lm_conformal_ completed [2.8s, 18.29 MB]
+ summary_votes_governor_25_dem_precinct_total_lm_conformal_ dispatched
✔ summary_votes_governor_25_rep_share_lm_conformal_ completed [4ms, 509 B]
+ model_turnout_xgboost_conformal__1 dispatched
✔ summary_votes_governor_25_dem_precinct_total_lm_conformal_ completed [4ms, 512 B]
+ model_turnout_lm_conformal__2 dispatched
✔ model_turnout_xgboost_conformal_ completed [6.8s, 23.85 MB]
+ summary_turnout_xgboost_conformal_ dispatched
✔ model_turnout_lm_conformal__2 completed [2.6s, 19.23 MB]
+ summary_turnout_lm_conformal__2 dispatched
✔ summary_turnout_xgboost_conformal_ completed [4ms, 490 B]
+ model_turnout_xgboost_conformal__2 dispatched
✔ model_turnout_lm_conformal__1 completed [2.7s, 28.11 MB]
+ summary_turnout_lm_conformal__1 dispatched
✔ summary_turnout_lm_conformal__2 completed [4ms, 494 B]
+ model_votes_governor_25_dem_share_xgboost_conformal_ dispatched
✔ summary_turnout_lm_conformal__1 completed [4ms, 591 B]
+ model_votes_governor_25_dem_share_xgboost_conformal__1 dispatched
✖ model_votes_governor_25_dem_share_xgboost_conformal_ errored
Error: [20:54:38] src/data/data.cc:461: Check failed: valid: Label contains NaN, infinity or a value too large.
Stack trace:
  [bt] (0) 1   xgboost.so                          0x000000014280ef7c dmlc::LogMessageFatal::~LogMessageFatal() + 124
  [bt] (1) 2   xgboost.so                          0x00000001428add60 xgboost::MetaInfo::SetInfoFromHost(xgboost::GenericParameter const&, xgboost::StringView, xgboost::Json) + 3616
  [bt] (2) 3   xgboost.so                          0x00000001428aefe8 xgboost::MetaInfo::SetInfo(xgboost::GenericParameter const&, char const*, void const*, xgboost::DataType, unsigned long) + 168
  [bt] (3) 4   xgboost.so                          0x00000001429d8444 XGDMatrixSetFloatInfo + 132
  [bt] (4) 5   xgboost.so                          0x000000014280a16c XGDMatrixSetInfo_R + 620
  [bt] (5) 6   libR.dylib                          0x00000001030ab3b4 R_doDotCall + 1588
  [bt] (6) 7   libR.dylib                          0x00000001030fde98 bcEval_loop + 86104
  [bt] (7) 8

+ model_votes_governor_25_rep_precinct_total_xgboost_conformal_ dispatched
✖ model_votes_governor_25_dem_share_xgboost_conformal__1 errored
Error: [20:54:38] src/data/data.cc:461: Check failed: valid: Label contains NaN, infinity or a value too large.
Stack trace:
  [bt] (0) 1   xgboost.so                          0x000000015380ef7c dmlc::LogMessageFatal::~LogMessageFatal() + 124
  [bt] (1) 2   xgboost.so                          0x00000001538add60 xgboost::MetaInfo::SetInfoFromHost(xgboost::GenericParameter const&, xgboost::StringView, xgboost::Json) + 3616
  [bt] (2) 3   xgboost.so                          0x00000001538aefe8 xgboost::MetaInfo::SetInfo(xgboost::GenericParameter const&, char const*, void const*, xgboost::DataType, unsigned long) + 168
  [bt] (3) 4   xgboost.so                          0x00000001539d8444 XGDMatrixSetFloatInfo + 132
  [bt] (4) 5   xgboost.so                          0x000000015380a16c XGDMatrixSetInfo_R + 620
  [bt] (5) 6   libR.dylib                          0x000000010539b3b4 R_doDotCall + 1588
  [bt] (6) 7   libR.dylib                          0x00000001053ede98 bcEval_loop + 86104
  [bt] (7) 8

+ model_votes_governor_25_dem_share_xgboost_conformal__2 dispatched
✖ model_votes_governor_25_dem_share_xgboost_conformal__2 errored
Error: [20:54:38] src/data/data.cc:461: Check failed: valid: Label contains NaN, infinity or a value too large.
Stack trace:
  [bt] (0) 1   xgboost.so                          0x000000015380ef7c dmlc::LogMessageFatal::~LogMessageFatal() + 124
  [bt] (1) 2   xgboost.so                          0x00000001538add60 xgboost::MetaInfo::SetInfoFromHost(xgboost::GenericParameter const&, xgboost::StringView, xgboost::Json) + 3616
  [bt] (2) 3   xgboost.so                          0x00000001538aefe8 xgboost::MetaInfo::SetInfo(xgboost::GenericParameter const&, char const*, void const*, xgboost::DataType, unsigned long) + 168
  [bt] (3) 4   xgboost.so                          0x00000001539d8444 XGDMatrixSetFloatInfo + 132
  [bt] (4) 5   xgboost.so                          0x000000015380a16c XGDMatrixSetInfo_R + 620
  [bt] (5) 6   libR.dylib                          0x000000010539b3b4 R_doDotCall + 1588
  [bt] (6) 7   libR.dylib                          0x00000001053ede98 bcEval_loop + 86104
  [bt] (7) 8

+ model_turnout_lm_conformal_ dispatched
✔ model_turnout_lm_conformal_ completed [2.3s, 18.29 MB]
+ summary_turnout_lm_conformal_ dispatched
✔ summary_turnout_lm_conformal_ completed [5ms, 486 B]
+ model_votes_governor_25_rep_share_xgboost_conformal_ dispatched
✔ model_turnout_xgboost_conformal__1 completed [11.3s, 25.52 MB]
+ summary_turnout_xgboost_conformal__1 dispatched
✔ model_votes_governor_25_rep_precinct_total_xgboost_conformal_ completed [5.9s, 23.86 MB]
+ summary_votes_governor_25_rep_precinct_total_xgboost_conformal_ dispatched
✔ summary_turnout_xgboost_conformal__1 completed [3ms, 597 B]
+ model_votes_governor_25_rep_precinct_total_lm_conformal__1 dispatched
✔ summary_votes_governor_25_rep_precinct_total_xgboost_conformal_ completed [5ms, 517 B]
+ model_votes_governor_25_rep_precinct_total_lm_conformal__2 dispatched
✔ model_turnout_xgboost_conformal__2 completed [7.5s, 24.29 MB]
+ summary_turnout_xgboost_conformal__2 dispatched
✔ summary_turnout_xgboost_conformal__2 completed [8ms, 498 B]
+ model_votes_governor_25_dem_share_lm_conformal_ dispatched
✔ model_votes_governor_25_rep_precinct_total_lm_conformal__2 completed [2.4s, 19.16 MB]
+ summary_votes_governor_25_rep_precinct_total_lm_conformal__2 dispatched
✔ model_votes_governor_25_rep_precinct_total_lm_conformal__1 completed [2.7s, 27.82 MB]
+ summary_votes_governor_25_rep_precinct_total_lm_conformal__1 dispatched
✔ summary_votes_governor_25_rep_precinct_total_lm_conformal__2 completed [8ms, 519 B]
+ model_votes_governor_25_dem_share_lm_conformal__1 dispatched
✔ model_votes_governor_25_dem_share_lm_conformal_ completed [2.3s, 18.93 MB]
+ summary_votes_governor_25_dem_share_lm_conformal_ dispatched
✔ summary_votes_governor_25_rep_precinct_total_lm_conformal__1 completed [4ms, 607 B]
+ model_votes_governor_25_dem_share_lm_conformal__2 dispatched
✔ summary_votes_governor_25_dem_share_lm_conformal_ completed [7ms, 508 B]
+ model_votes_governor_25_rep_share_lm_conformal__1 dispatched
✔ model_votes_governor_25_rep_share_xgboost_conformal_ completed [6.1s, 24.35 MB]
+ summary_votes_governor_25_rep_share_xgboost_conformal_ dispatched
✔ summary_votes_governor_25_rep_share_xgboost_conformal_ completed [4ms, 514 B]
+ model_votes_governor_25_rep_share_lm_conformal__2 dispatched
✔ model_votes_governor_25_dem_share_lm_conformal__2 completed [2.5s, 19.87 MB]
+ summary_votes_governor_25_dem_share_lm_conformal__2 dispatched
✔ model_votes_governor_25_dem_share_lm_conformal__1 completed [2.5s, 28.63 MB]
+ summary_votes_governor_25_dem_share_lm_conformal__1 dispatched
✔ model_votes_governor_25_rep_share_lm_conformal__2 completed [2.2s, 19.74 MB]
+ summary_votes_governor_25_rep_share_lm_conformal__2 dispatched
✔ summary_votes_governor_25_dem_share_lm_conformal__2 completed [4ms, 514 B]
+ model_votes_governor_25_rep_precinct_total_xgboost_conformal__1 dispatched
✔ model_votes_governor_25_rep_share_lm_conformal__1 completed [2.3s, 28.49 MB]
+ summary_votes_governor_25_rep_share_lm_conformal__1 dispatched
✔ summary_votes_governor_25_rep_share_lm_conformal__2 completed [3ms, 516 B]
+ model_votes_governor_25_rep_precinct_total_xgboost_conformal__2 dispatched
✔ summary_votes_governor_25_dem_share_lm_conformal__1 completed [5ms, 605 B]
+ model_votes_governor_25_rep_share_xgboost_conformal__1 dispatched
✔ summary_votes_governor_25_rep_share_lm_conformal__1 completed [13ms, 611 B]
+ model_votes_governor_25_rep_share_xgboost_conformal__2 dispatched
✔ model_votes_governor_25_rep_precinct_total_xgboost_conformal__2 completed [6.3s, 24.50 MB]
+ summary_votes_governor_25_rep_precinct_total_xgboost_conformal__2 dispatched
✔ model_votes_governor_25_rep_share_xgboost_conformal__2 completed [6.3s, 24.08 MB]
+ summary_votes_governor_25_rep_share_xgboost_conformal__2 dispatched
✔ summary_votes_governor_25_rep_precinct_total_xgboost_conformal__2 completed [4ms, 522 B]
+ tbl_cbs_VA_NA dispatched
✔ summary_votes_governor_25_rep_share_xgboost_conformal__2 completed [4ms, 521 B]
+ model_votes_governor_25_dem_precinct_total_lm_conformal__1 dispatched
✔ model_votes_governor_25_rep_precinct_total_xgboost_conformal__1 completed [11.1s, 25.23 MB]
+ summary_votes_governor_25_rep_precinct_total_xgboost_conformal__1 dispatched
✔ model_votes_governor_25_rep_share_xgboost_conformal__1 completed [11.1s, 25.45 MB]
+ summary_votes_governor_25_rep_share_xgboost_conformal__1 dispatched
✔ summary_votes_governor_25_rep_precinct_total_xgboost_conformal__1 completed [4ms, 609 B]
+ model_votes_governor_25_dem_precinct_total_lm_conformal__2 dispatched
✔ summary_votes_governor_25_rep_share_xgboost_conformal__1 completed [3ms, 610 B]
+ model_votes_governor_25_dem_precinct_total_xgboost_conformal__1 dispatched
✔ model_votes_governor_25_dem_precinct_total_lm_conformal__1 completed [2.7s, 28.12 MB]
+ summary_votes_governor_25_dem_precinct_total_lm_conformal__1 dispatched
✖ model_votes_governor_25_dem_precinct_total_xgboost_conformal__1 errored
Error: [20:55:10] src/data/data.cc:461: Check failed: valid: Label contains NaN, infinity or a value too large.
Stack trace:
  [bt] (0) 1   xgboost.so                          0x000000014280ef7c dmlc::LogMessageFatal::~LogMessageFatal() + 124
  [bt] (1) 2   xgboost.so                          0x00000001428add60 xgboost::MetaInfo::SetInfoFromHost(xgboost::GenericParameter const&, xgboost::StringView, xgboost::Json) + 3616
  [bt] (2) 3   xgboost.so                          0x00000001428aefe8 xgboost::MetaInfo::SetInfo(xgboost::GenericParameter const&, char const*, void const*, xgboost::DataType, unsigned long) + 168
  [bt] (3) 4   xgboost.so                          0x00000001429d8444 XGDMatrixSetFloatInfo + 132
  [bt] (4) 5   xgboost.so                          0x000000014280a16c XGDMatrixSetInfo_R + 620
  [bt] (5) 6   libR.dylib                          0x00000001030ab3b4 R_doDotCall + 1588
  [bt] (6) 7   libR.dylib                          0x00000001030fde98 bcEval_loop + 86104
  [bt] (7) 8

+ model_votes_governor_25_dem_precinct_total_xgboost_conformal__2 dispatched
✔ summary_votes_governor_25_dem_precinct_total_lm_conformal__1 completed [3ms, 608 B]
+ summary_VA_NA dispatched
✖ model_votes_governor_25_dem_precinct_total_xgboost_conformal__2 errored
Error: [20:55:11] src/data/data.cc:461: Check failed: valid: Label contains NaN, infinity or a value too large.
Stack trace:
  [bt] (0) 1   xgboost.so                          0x000000014280ef7c dmlc::LogMessageFatal::~LogMessageFatal() + 124
  [bt] (1) 2   xgboost.so                          0x00000001428add60 xgboost::MetaInfo::SetInfoFromHost(xgboost::GenericParameter const&, xgboost::StringView, xgboost::Json) + 3616
  [bt] (2) 3   xgboost.so                          0x00000001428aefe8 xgboost::MetaInfo::SetInfo(xgboost::GenericParameter const&, char const*, void const*, xgboost::DataType, unsigned long) + 168
  [bt] (3) 4   xgboost.so                          0x00000001429d8444 XGDMatrixSetFloatInfo + 132
  [bt] (4) 5   xgboost.so                          0x000000014280a16c XGDMatrixSetInfo_R + 620
  [bt] (5) 6   libR.dylib                          0x00000001030ab3b4 R_doDotCall + 1588
  [bt] (6) 7   libR.dylib                          0x00000001030fde98 bcEval_loop + 86104
  [bt] (7) 8

+ corymodel dispatched
✔ summary_VA_NA completed [307ms, 659 B]
+ model_votes_governor_25_dem_precinct_total_xgboost_conformal_ dispatched
✖ model_votes_governor_25_dem_precinct_total_xgboost_conformal_ errored
Error: [20:55:11] src/data/data.cc:461: Check failed: valid: Label contains NaN, infinity or a value too large.
Stack trace:
  [bt] (0) 1   xgboost.so                          0x000000015380ef7c dmlc::LogMessageFatal::~LogMessageFatal() + 124
  [bt] (1) 2   xgboost.so                          0x00000001538add60 xgboost::MetaInfo::SetInfoFromHost(xgboost::GenericParameter const&, xgboost::StringView, xgboost::Json) + 3616
  [bt] (2) 3   xgboost.so                          0x00000001538aefe8 xgboost::MetaInfo::SetInfo(xgboost::GenericParameter const&, char const*, void const*, xgboost::DataType, unsigned long) + 168
  [bt] (3) 4   xgboost.so                          0x00000001539d8444 XGDMatrixSetFloatInfo + 132
  [bt] (4) 5   xgboost.so                          0x000000015380a16c XGDMatrixSetInfo_R + 620
  [bt] (5) 6   libR.dylib                          0x000000010539b3b4 R_doDotCall + 1588
  [bt] (6) 7   libR.dylib                          0x00000001053ede98 bcEval_loop + 86104
  [bt] (7) 8

✔ model_votes_governor_25_dem_precinct_total_lm_conformal__2 completed [2.4s, 19.37 MB]
+ summary_votes_governor_25_dem_precinct_total_lm_conformal__2 dispatched
✔ summary_votes_governor_25_dem_precinct_total_lm_conformal__2 completed [3ms, 519 B]
+ models_summary dispatched
✔ models_summary completed [1ms, 3.79 kB]
+ save_summaries dispatched
✔ save_summaries completed [1ms, 43 B]
+ dashboard dispatched
✖ corymodel errored
Error: object 'm_simple_pres' not found

✔ tbl_cbs_VA_NA completed [20.6s, 177.85 kB]
✔ dashboard completed [23.3s, 16.37 MB]
+ upload dispatched
✔ upload completed [1s, 46 B]
✖ errored pipeline [1m 30.1s, 60 completed, 8 skipped]
Warning message:
9 targets produced errors. Run targets::tar_meta(fields = error, complete_only = TRUE) for the messages. 
