2025-11-04 20:57:55: Running tar_make
- The project is out-of-sync -- use `renv::status()` for details.
+ timestamp_VA_NA dispatched
+ timestamp_NY_NA dispatched
✔ timestamp_VA_NA completed [1.9s, 71 B]
+ data_VA_NA dispatched
✔ timestamp_NY_NA completed [1.8s, 69 B]
✔ data_VA_NA completed [12.7s, 654.01 kB]
+ model_votes_governor_25_rep_share_lm_conformal_ dispatched
+ model_votes_governor_25_rep_precinct_total_lm_conformal_ dispatched
+ model_votes_governor_25_dem_precinct_total_lm_conformal_ dispatched
+ model_turnout_xgboost_conformal_ dispatched
✔ model_votes_governor_25_rep_share_lm_conformal_ completed [2.6s, 18.98 MB]
+ summary_votes_governor_25_rep_share_lm_conformal_ dispatched
✔ summary_votes_governor_25_rep_share_lm_conformal_ completed [3ms, 509 B]
+ model_turnout_lm_conformal__1 dispatched
✔ model_votes_governor_25_rep_precinct_total_lm_conformal_ completed [2.9s, 18.31 MB]
+ summary_votes_governor_25_rep_precinct_total_lm_conformal_ dispatched
✔ summary_votes_governor_25_rep_precinct_total_lm_conformal_ completed [3ms, 512 B]
+ model_turnout_xgboost_conformal__1 dispatched
✔ model_votes_governor_25_dem_precinct_total_lm_conformal_ completed [2.9s, 18.53 MB]
+ summary_votes_governor_25_dem_precinct_total_lm_conformal_ dispatched
✔ model_turnout_lm_conformal__1 completed [2.7s, 28.54 MB]
+ summary_turnout_lm_conformal__1 dispatched
✔ summary_turnout_lm_conformal__1 completed [4ms, 591 B]
+ model_turnout_lm_conformal__2 dispatched
✔ summary_votes_governor_25_dem_precinct_total_lm_conformal_ completed [4ms, 511 B]
+ model_turnout_xgboost_conformal__2 dispatched
✔ model_turnout_lm_conformal__2 completed [2.2s, 19.49 MB]
+ summary_turnout_lm_conformal__2 dispatched
✔ model_turnout_xgboost_conformal_ completed [6.8s, 24.14 MB]
+ summary_turnout_xgboost_conformal_ dispatched
✔ summary_turnout_lm_conformal__2 completed [3ms, 493 B]
+ model_votes_governor_25_dem_share_xgboost_conformal_ dispatched
✔ summary_turnout_xgboost_conformal_ completed [3ms, 489 B]
+ model_votes_governor_25_dem_share_xgboost_conformal__1 dispatched
✖ model_votes_governor_25_dem_share_xgboost_conformal_ errored
Error: [20:58:31] src/data/data.cc:461: Check failed: valid: Label contains NaN, infinity or a value too large.
Stack trace:
  [bt] (0) 1   xgboost.so                          0x000000013c00ef7c dmlc::LogMessageFatal::~LogMessageFatal() + 124
  [bt] (1) 2   xgboost.so                          0x000000013c0add60 xgboost::MetaInfo::SetInfoFromHost(xgboost::GenericParameter const&, xgboost::StringView, xgboost::Json) + 3616
  [bt] (2) 3   xgboost.so                          0x000000013c0aefe8 xgboost::MetaInfo::SetInfo(xgboost::GenericParameter const&, char const*, void const*, xgboost::DataType, unsigned long) + 168
  [bt] (3) 4   xgboost.so                          0x000000013c1d8444 XGDMatrixSetFloatInfo + 132
  [bt] (4) 5   xgboost.so                          0x000000013c00a16c XGDMatrixSetInfo_R + 620
  [bt] (5) 6   libR.dylib                          0x0000000103a473b4 R_doDotCall + 1588
  [bt] (6) 7   libR.dylib                          0x0000000103a99e98 bcEval_loop + 86104
  [bt] (7) 8

+ model_votes_governor_25_rep_precinct_total_xgboost_conformal_ dispatched
✖ model_votes_governor_25_dem_share_xgboost_conformal__1 errored
Error: [20:58:31] src/data/data.cc:461: Check failed: valid: Label contains NaN, infinity or a value too large.
Stack trace:
  [bt] (0) 1   xgboost.so                          0x000000016680ef7c dmlc::LogMessageFatal::~LogMessageFatal() + 124
  [bt] (1) 2   xgboost.so                          0x00000001668add60 xgboost::MetaInfo::SetInfoFromHost(xgboost::GenericParameter const&, xgboost::StringView, xgboost::Json) + 3616
  [bt] (2) 3   xgboost.so                          0x00000001668aefe8 xgboost::MetaInfo::SetInfo(xgboost::GenericParameter const&, char const*, void const*, xgboost::DataType, unsigned long) + 168
  [bt] (3) 4   xgboost.so                          0x00000001669d8444 XGDMatrixSetFloatInfo + 132
  [bt] (4) 5   xgboost.so                          0x000000016680a16c XGDMatrixSetInfo_R + 620
  [bt] (5) 6   libR.dylib                          0x0000000104ac33b4 R_doDotCall + 1588
  [bt] (6) 7   libR.dylib                          0x0000000104b15e98 bcEval_loop + 86104
  [bt] (7) 8

+ model_votes_governor_25_dem_share_xgboost_conformal__2 dispatched
✖ model_votes_governor_25_dem_share_xgboost_conformal__2 errored
Error: [20:58:32] src/data/data.cc:461: Check failed: valid: Label contains NaN, infinity or a value too large.
Stack trace:
  [bt] (0) 1   xgboost.so                          0x000000016680ef7c dmlc::LogMessageFatal::~LogMessageFatal() + 124
  [bt] (1) 2   xgboost.so                          0x00000001668add60 xgboost::MetaInfo::SetInfoFromHost(xgboost::GenericParameter const&, xgboost::StringView, xgboost::Json) + 3616
  [bt] (2) 3   xgboost.so                          0x00000001668aefe8 xgboost::MetaInfo::SetInfo(xgboost::GenericParameter const&, char const*, void const*, xgboost::DataType, unsigned long) + 168
  [bt] (3) 4   xgboost.so                          0x00000001669d8444 XGDMatrixSetFloatInfo + 132
  [bt] (4) 5   xgboost.so                          0x000000016680a16c XGDMatrixSetInfo_R + 620
  [bt] (5) 6   libR.dylib                          0x0000000104ac33b4 R_doDotCall + 1588
  [bt] (6) 7   libR.dylib                          0x0000000104b15e98 bcEval_loop + 86104
  [bt] (7) 8

+ model_turnout_lm_conformal_ dispatched
✔ model_turnout_xgboost_conformal__1 completed [11.6s, 25.87 MB]
+ summary_turnout_xgboost_conformal__1 dispatched
✔ summary_turnout_xgboost_conformal__1 completed [5ms, 590 B]
+ model_votes_governor_25_rep_share_xgboost_conformal_ dispatched
✔ model_turnout_xgboost_conformal__2 completed [7.5s, 24.55 MB]
+ summary_turnout_xgboost_conformal__2 dispatched
✔ model_turnout_lm_conformal_ completed [2.5s, 18.54 MB]
+ summary_turnout_lm_conformal_ dispatched
✔ summary_turnout_xgboost_conformal__2 completed [3ms, 498 B]
+ model_votes_governor_25_rep_precinct_total_lm_conformal__1 dispatched
✔ summary_turnout_lm_conformal_ completed [4ms, 486 B]
+ model_votes_governor_25_rep_precinct_total_lm_conformal__2 dispatched
✔ model_votes_governor_25_rep_precinct_total_xgboost_conformal_ completed [6.2s, 24.14 MB]
+ summary_votes_governor_25_rep_precinct_total_xgboost_conformal_ dispatched
✔ summary_votes_governor_25_rep_precinct_total_xgboost_conformal_ completed [6ms, 517 B]
+ model_votes_governor_25_dem_share_lm_conformal_ dispatched
✔ model_votes_governor_25_rep_precinct_total_lm_conformal__2 completed [2.4s, 19.43 MB]
+ summary_votes_governor_25_rep_precinct_total_lm_conformal__2 dispatched
✔ model_votes_governor_25_rep_precinct_total_lm_conformal__1 completed [2.5s, 28.25 MB]
+ summary_votes_governor_25_rep_precinct_total_lm_conformal__1 dispatched
✔ summary_votes_governor_25_rep_precinct_total_lm_conformal__2 completed [4ms, 518 B]
+ model_votes_governor_25_dem_share_lm_conformal__1 dispatched
✔ summary_votes_governor_25_rep_precinct_total_lm_conformal__1 completed [3ms, 608 B]
+ model_votes_governor_25_dem_share_lm_conformal__2 dispatched
✔ model_votes_governor_25_dem_share_lm_conformal_ completed [2.3s, 19.18 MB]
+ summary_votes_governor_25_dem_share_lm_conformal_ dispatched
✔ model_votes_governor_25_rep_share_xgboost_conformal_ completed [6.1s, 24.56 MB]
+ summary_votes_governor_25_rep_share_xgboost_conformal_ dispatched
✔ summary_votes_governor_25_dem_share_lm_conformal_ completed [3ms, 508 B]
+ model_votes_governor_25_rep_share_lm_conformal__1 dispatched
✔ summary_votes_governor_25_rep_share_xgboost_conformal_ completed [4ms, 514 B]
+ model_votes_governor_25_rep_share_lm_conformal__2 dispatched
✔ model_votes_governor_25_dem_share_lm_conformal__2 completed [2.1s, 20.14 MB]
+ summary_votes_governor_25_dem_share_lm_conformal__2 dispatched
✔ summary_votes_governor_25_dem_share_lm_conformal__2 completed [3ms, 517 B]
+ model_votes_governor_25_rep_precinct_total_xgboost_conformal__1 dispatched
✔ model_votes_governor_25_dem_share_lm_conformal__1 completed [2.4s, 29.06 MB]
+ summary_votes_governor_25_dem_share_lm_conformal__1 dispatched
✔ summary_votes_governor_25_dem_share_lm_conformal__1 completed [5ms, 606 B]
+ model_votes_governor_25_rep_precinct_total_xgboost_conformal__2 dispatched
✔ model_votes_governor_25_rep_share_lm_conformal__2 completed [2.3s, 20.02 MB]
+ summary_votes_governor_25_rep_share_lm_conformal__2 dispatched
✔ summary_votes_governor_25_rep_share_lm_conformal__2 completed [2ms, 516 B]
+ model_votes_governor_25_rep_share_xgboost_conformal__1 dispatched
✔ model_votes_governor_25_rep_share_lm_conformal__1 completed [2.4s, 28.92 MB]
+ summary_votes_governor_25_rep_share_lm_conformal__1 dispatched
✔ summary_votes_governor_25_rep_share_lm_conformal__1 completed [4ms, 608 B]
+ model_votes_governor_25_rep_share_xgboost_conformal__2 dispatched
+ model_votes_governor_25_rep_share_xgboost_conformal__2 dispatched
+ model_votes_governor_25_rep_share_xgboost_conformal__1 dispatched
✔ model_votes_governor_25_rep_precinct_total_xgboost_conformal__2 completed [6.3s, 24.92 MB]
+ summary_votes_governor_25_rep_precinct_total_xgboost_conformal__2 dispatched
✔ summary_votes_governor_25_rep_precinct_total_xgboost_conformal__2 completed [11ms, 524 B]
+ tbl_cbs_VA_NA dispatched
✔ model_votes_governor_25_rep_precinct_total_xgboost_conformal__1 completed [11.1s, 25.59 MB]
+ summary_votes_governor_25_rep_precinct_total_xgboost_conformal__1 dispatched
✔ summary_votes_governor_25_rep_precinct_total_xgboost_conformal__1 completed [3ms, 612 B]
+ model_votes_governor_25_dem_precinct_total_lm_conformal__1 dispatched
✔ model_votes_governor_25_rep_share_xgboost_conformal__2 completed [6.4s, 24.44 MB]
+ summary_votes_governor_25_rep_share_xgboost_conformal__2 dispatched
✔ model_votes_governor_25_dem_precinct_total_lm_conformal__1 completed [2.3s, 28.54 MB]
+ summary_votes_governor_25_dem_precinct_total_lm_conformal__1 dispatched
✔ summary_votes_governor_25_rep_share_xgboost_conformal__2 completed [9ms, 521 B]
+ model_votes_governor_25_dem_precinct_total_lm_conformal__2 dispatched
✔ summary_votes_governor_25_dem_precinct_total_lm_conformal__1 completed [4ms, 612 B]
+ model_votes_governor_25_dem_precinct_total_xgboost_conformal__1 dispatched
✖ model_votes_governor_25_dem_precinct_total_xgboost_conformal__1 errored
Error: [20:59:04] src/data/data.cc:461: Check failed: valid: Label contains NaN, infinity or a value too large.
Stack trace:
  [bt] (0) 1   xgboost.so                          0x0000000122a0af7c dmlc::LogMessageFatal::~LogMessageFatal() + 124
  [bt] (1) 2   xgboost.so                          0x0000000122aa9d60 xgboost::MetaInfo::SetInfoFromHost(xgboost::GenericParameter const&, xgboost::StringView, xgboost::Json) + 3616
  [bt] (2) 3   xgboost.so                          0x0000000122aaafe8 xgboost::MetaInfo::SetInfo(xgboost::GenericParameter const&, char const*, void const*, xgboost::DataType, unsigned long) + 168
  [bt] (3) 4   xgboost.so                          0x0000000122bd4444 XGDMatrixSetFloatInfo + 132
  [bt] (4) 5   xgboost.so                          0x0000000122a0616c XGDMatrixSetInfo_R + 620
  [bt] (5) 6   libR.dylib                          0x000000010598b3b4 R_doDotCall + 1588
  [bt] (6) 7   libR.dylib                          0x00000001059dde98 bcEval_loop + 86104
  [bt] (7) 8

+ model_votes_governor_25_dem_precinct_total_xgboost_conformal__2 dispatched
✖ model_votes_governor_25_dem_precinct_total_xgboost_conformal__2 errored
Error: [20:59:05] src/data/data.cc:461: Check failed: valid: Label contains NaN, infinity or a value too large.
Stack trace:
  [bt] (0) 1   xgboost.so                          0x0000000122a0af7c dmlc::LogMessageFatal::~LogMessageFatal() + 124
  [bt] (1) 2   xgboost.so                          0x0000000122aa9d60 xgboost::MetaInfo::SetInfoFromHost(xgboost::GenericParameter const&, xgboost::StringView, xgboost::Json) + 3616
  [bt] (2) 3   xgboost.so                          0x0000000122aaafe8 xgboost::MetaInfo::SetInfo(xgboost::GenericParameter const&, char const*, void const*, xgboost::DataType, unsigned long) + 168
  [bt] (3) 4   xgboost.so                          0x0000000122bd4444 XGDMatrixSetFloatInfo + 132
  [bt] (4) 5   xgboost.so                          0x0000000122a0616c XGDMatrixSetInfo_R + 620
  [bt] (5) 6   libR.dylib                          0x000000010598b3b4 R_doDotCall + 1588
  [bt] (6) 7   libR.dylib                          0x00000001059dde98 bcEval_loop + 86104
  [bt] (7) 8

+ summary_VA_NA dispatched
✔ summary_VA_NA completed [407ms, 655 B]
+ corymodel dispatched
✔ model_votes_governor_25_dem_precinct_total_lm_conformal__2 completed [2.4s, 19.64 MB]
+ summary_votes_governor_25_dem_precinct_total_lm_conformal__2 dispatched
✔ summary_votes_governor_25_dem_precinct_total_lm_conformal__2 completed [4ms, 518 B]
+ model_votes_governor_25_dem_precinct_total_xgboost_conformal_ dispatched
✖ model_votes_governor_25_dem_precinct_total_xgboost_conformal_ errored
Error: [20:59:09] src/data/data.cc:461: Check failed: valid: Label contains NaN, infinity or a value too large.
Stack trace:
  [bt] (0) 1   xgboost.so                          0x000000016680ef7c dmlc::LogMessageFatal::~LogMessageFatal() + 124
  [bt] (1) 2   xgboost.so                          0x00000001668add60 xgboost::MetaInfo::SetInfoFromHost(xgboost::GenericParameter const&, xgboost::StringView, xgboost::Json) + 3616
  [bt] (2) 3   xgboost.so                          0x00000001668aefe8 xgboost::MetaInfo::SetInfo(xgboost::GenericParameter const&, char const*, void const*, xgboost::DataType, unsigned long) + 168
  [bt] (3) 4   xgboost.so                          0x00000001669d8444 XGDMatrixSetFloatInfo + 132
  [bt] (4) 5   xgboost.so                          0x000000016680a16c XGDMatrixSetInfo_R + 620
  [bt] (5) 6   libR.dylib                          0x0000000104ac33b4 R_doDotCall + 1588
  [bt] (6) 7   libR.dylib                          0x0000000104b15e98 bcEval_loop + 86104
  [bt] (7) 8

✖ corymodel errored
Error: object 'm_simple_pres' not found

✔ model_votes_governor_25_rep_share_xgboost_conformal__1 completed [12s, 25.83 MB]
+ summary_votes_governor_25_rep_share_xgboost_conformal__1 dispatched
✔ summary_votes_governor_25_rep_share_xgboost_conformal__1 completed [3ms, 612 B]
+ models_summary dispatched
✔ models_summary completed [1ms, 3.79 kB]
+ save_summaries dispatched
✔ save_summaries completed [1ms, 43 B]
+ dashboard dispatched
✔ tbl_cbs_VA_NA completed [19s, 178.44 kB]
✔ dashboard completed [21.9s, 16.37 MB]
+ upload dispatched
✔ upload completed [1s, 46 B]
✖ errored pipeline [1m 37.5s, 57 completed, 13 skipped]
Warning message:
7 targets produced errors. Run targets::tar_meta(fields = error, complete_only = TRUE) for the messages. 
